{
  "name": "cmt_hash_005_escapes",
  "description": "RFC 8785 3.2.2 escaping: embedded quote/backslash, tab/newline short-form escapes, non-ASCII, and an astral-plane codepoint; NOT derived from 001",
  "label": "macp-commitment-hash/1",
  "payload": {
    "commitment_id": "c5",
    "action": "decision.\"appro\\ved\"",
    "authority_scope": "caf\u00e9",
    "reason": "r\u00e9\tsum\u00e9\n\u2014 na\u00efve \ud83d\udf02",
    "mode_version": "macp.mode.decision.v1",
    "policy_version": "1.0.0",
    "configuration_version": "1.0.0",
    "outcome_positive": false
  },
  "jcs_utf8_hex": "7b22616374696f6e223a226465636973696f6e2e5c22617070726f5c5c7665645c22222c22617574686f726974795f73636f7065223a22636166c3a9222c22636f6d6d69746d656e745f6964223a226335222c22636f6e66696775726174696f6e5f76657273696f6e223a22312e302e30222c226d6f64655f76657273696f6e223a226d6163702e6d6f64652e6465636973696f6e2e7631222c226f7574636f6d655f706f736974697665223a66616c73652c22706f6c6963795f76657273696f6e223a22312e302e30222c22726561736f6e223a2272c3a95c7473756dc3a95c6ee28094206e61c3af766520f09f9c82227d",
  "preimage_utf8_hex": "6d6163702d636f6d6d69746d656e742d686173682f313a7b22616374696f6e223a226465636973696f6e2e5c22617070726f5c5c7665645c22222c22617574686f726974795f73636f7065223a22636166c3a9222c22636f6d6d69746d656e745f6964223a226335222c22636f6e66696775726174696f6e5f76657273696f6e223a22312e302e30222c226d6f64655f76657273696f6e223a226d6163702e6d6f64652e6465636973696f6e2e7631222c226f7574636f6d655f706f736974697665223a66616c73652c22706f6c6963795f76657273696f6e223a22312e302e30222c22726561736f6e223a2272c3a95c7473756dc3a95c6ee28094206e61c3af766520f09f9c82227d",
  "hash": "sha256:03f8ac2b8172958504092ce9fe5154dbcfe300fd30a350453d4e4bd715822ab2"
}
