{
  "name": "cmt_hash_003_all_empty",
  "description": "every string field \"\", outcome_positive false, no supersedes",
  "label": "macp-commitment-hash/1",
  "payload": {
    "commitment_id": "",
    "action": "",
    "authority_scope": "",
    "reason": "",
    "mode_version": "",
    "policy_version": "",
    "configuration_version": "",
    "outcome_positive": false
  },
  "jcs_utf8_hex": "7b22616374696f6e223a22222c22617574686f726974795f73636f7065223a22222c22636f6d6d69746d656e745f6964223a22222c22636f6e66696775726174696f6e5f76657273696f6e223a22222c226d6f64655f76657273696f6e223a22222c226f7574636f6d655f706f736974697665223a66616c73652c22706f6c6963795f76657273696f6e223a22222c22726561736f6e223a22227d",
  "preimage_utf8_hex": "6d6163702d636f6d6d69746d656e742d686173682f313a7b22616374696f6e223a22222c22617574686f726974795f73636f7065223a22222c22636f6d6d69746d656e745f6964223a22222c22636f6e66696775726174696f6e5f76657273696f6e223a22222c226d6f64655f76657273696f6e223a22222c226f7574636f6d655f706f736974697665223a66616c73652c22706f6c6963795f76657273696f6e223a22222c22726561736f6e223a22227d",
  "hash": "sha256:3240d1a7adb7bd9420ad5490182227ce699c9e4e465f7934885fe2ded939f32e"
}
