{
  "name": "cmt_hash_002_supersedes",
  "description": "= cmt_hash_001_minimal with commitment_id \"c2\" and supersedes chained to 001's own hash; inside supersedes, JCS sorts commitment_hash before session_id",
  "label": "macp-commitment-hash/1",
  "payload": {
    "commitment_id": "c2",
    "action": "decision.approved",
    "authority_scope": "seam",
    "reason": "sealed by seam",
    "mode_version": "macp.mode.decision.v1",
    "policy_version": "1.0.0",
    "configuration_version": "1.0.0",
    "outcome_positive": true,
    "supersedes": {
      "session_id": "prior-sess",
      "commitment_hash": "sha256:9f58e9d114d11860d48aa2bcb8cda458b9618b1cc8560595a802b68c4af85d41"
    }
  },
  "jcs_utf8_hex": "7b22616374696f6e223a226465636973696f6e2e617070726f766564222c22617574686f726974795f73636f7065223a227365616d222c22636f6d6d69746d656e745f6964223a226332222c22636f6e66696775726174696f6e5f76657273696f6e223a22312e302e30222c226d6f64655f76657273696f6e223a226d6163702e6d6f64652e6465636973696f6e2e7631222c226f7574636f6d655f706f736974697665223a747275652c22706f6c6963795f76657273696f6e223a22312e302e30222c22726561736f6e223a227365616c6564206279207365616d222c2273757065727365646573223a7b22636f6d6d69746d656e745f68617368223a227368613235363a39663538653964313134643131383630643438616132626362386364613435386239363138623163633835363035393561383032623638633461663835643431222c2273657373696f6e5f6964223a227072696f722d73657373227d7d",
  "preimage_utf8_hex": "6d6163702d636f6d6d69746d656e742d686173682f313a7b22616374696f6e223a226465636973696f6e2e617070726f766564222c22617574686f726974795f73636f7065223a227365616d222c22636f6d6d69746d656e745f6964223a226332222c22636f6e66696775726174696f6e5f76657273696f6e223a22312e302e30222c226d6f64655f76657273696f6e223a226d6163702e6d6f64652e6465636973696f6e2e7631222c226f7574636f6d655f706f736974697665223a747275652c22706f6c6963795f76657273696f6e223a22312e302e30222c22726561736f6e223a227365616c6564206279207365616d222c2273757065727365646573223a7b22636f6d6d69746d656e745f68617368223a227368613235363a39663538653964313134643131383630643438616132626362386364613435386239363138623163633835363035393561383032623638633461663835643431222c2273657373696f6e5f6964223a227072696f722d73657373227d7d",
  "hash": "sha256:7cc490432ad6b25e9c19fc7c3a84f1e33abe497fca1fd5266ff0275db3650f9d"
}
