{
  "name": "cmt_hash_009_unknown_supersedes_field",
  "description": "the payload of cmt_hash_001_minimal plus supersedes {session_id \"s0\", commitment_hash = 001's hash, unknown CommitmentRef field 3 = \"z\"}; the claim is the correct hash of the covered payload WITHOUT field 3, so a verifier that drops unknown fields reports match where a conforming one reports cannot-verify",
  "label": "macp-commitment-hash/1",
  "wire_hex": "0a02633112116465636973696f6e2e617070726f7665641a047365616d220e7365616c6564206279207365616d2a156d6163702e6d6f64652e6465636973696f6e2e76313205312e302e303a05312e302e3040014a500a02733012477368613235363a396635386539643131346431313836306434386161326263623863646134353862393631386231636338353630353935613830326236386334616638356434311a017a",
  "claimed_hash": "sha256:5b2e82b41d2a50095eef090cc4ef402e771a45e59e05895b6c77790f89fa2526",
  "expected_outcome": "cannot_verify"
}
