{
  "name": "cmt_hash_004_empty_supersedes",
  "description": "identical to cmt_hash_003_all_empty except supersedes is present with both session_id and commitment_hash set to \"\" -- not well-formed per RFC-MACP-0001 7.3.1, but hashable per RFC-MACP-0013 Section 6",
  "label": "macp-commitment-hash/1",
  "payload": {
    "commitment_id": "",
    "action": "",
    "authority_scope": "",
    "reason": "",
    "mode_version": "",
    "policy_version": "",
    "configuration_version": "",
    "outcome_positive": false,
    "supersedes": {
      "session_id": "",
      "commitment_hash": ""
    }
  },
  "jcs_utf8_hex": "7b22616374696f6e223a22222c22617574686f726974795f73636f7065223a22222c22636f6d6d69746d656e745f6964223a22222c22636f6e66696775726174696f6e5f76657273696f6e223a22222c226d6f64655f76657273696f6e223a22222c226f7574636f6d655f706f736974697665223a66616c73652c22706f6c6963795f76657273696f6e223a22222c22726561736f6e223a22222c2273757065727365646573223a7b22636f6d6d69746d656e745f68617368223a22222c2273657373696f6e5f6964223a22227d7d",
  "preimage_utf8_hex": "6d6163702d636f6d6d69746d656e742d686173682f313a7b22616374696f6e223a22222c22617574686f726974795f73636f7065223a22222c22636f6d6d69746d656e745f6964223a22222c22636f6e66696775726174696f6e5f76657273696f6e223a22222c226d6f64655f76657273696f6e223a22222c226f7574636f6d655f706f736974697665223a66616c73652c22706f6c6963795f76657273696f6e223a22222c22726561736f6e223a22222c2273757065727365646573223a7b22636f6d6d69746d656e745f68617368223a22222c2273657373696f6e5f6964223a22227d7d",
  "hash": "sha256:9776c22ef165f26817f89bb456cf6bc56a659eb1561a576f6ea9a435bd3291d7",
  "must_differ_from": "cmt_hash_003_all_empty"
}
