{
  "name": "cmt_hash_001_minimal",
  "description": "baseline; no supersedes",
  "label": "macp-commitment-hash/1",
  "payload": {
    "commitment_id": "c1",
    "action": "decision.approved",
    "authority_scope": "seam",
    "reason": "sealed by seam",
    "mode_version": "macp.mode.decision.v1",
    "policy_version": "1.0.0",
    "configuration_version": "1.0.0",
    "outcome_positive": true
  },
  "jcs_utf8_hex": "7b22616374696f6e223a226465636973696f6e2e617070726f766564222c22617574686f726974795f73636f7065223a227365616d222c22636f6d6d69746d656e745f6964223a226331222c22636f6e66696775726174696f6e5f76657273696f6e223a22312e302e30222c226d6f64655f76657273696f6e223a226d6163702e6d6f64652e6465636973696f6e2e7631222c226f7574636f6d655f706f736974697665223a747275652c22706f6c6963795f76657273696f6e223a22312e302e30222c22726561736f6e223a227365616c6564206279207365616d227d",
  "preimage_utf8_hex": "6d6163702d636f6d6d69746d656e742d686173682f313a7b22616374696f6e223a226465636973696f6e2e617070726f766564222c22617574686f726974795f73636f7065223a227365616d222c22636f6d6d69746d656e745f6964223a226331222c22636f6e66696775726174696f6e5f76657273696f6e223a22312e302e30222c226d6f64655f76657273696f6e223a226d6163702e6d6f64652e6465636973696f6e2e7631222c226f7574636f6d655f706f736974697665223a747275652c22706f6c6963795f76657273696f6e223a22312e302e30222c22726561736f6e223a227365616c6564206279207365616d227d",
  "hash": "sha256:9f58e9d114d11860d48aa2bcb8cda458b9618b1cc8560595a802b68c4af85d41"
}
